{
  "$schema": "https://raw.githubusercontent.com/gergely-somogyvari/ai-sdlc-kit/main/sdlc.config.schema.json",
  "version": 1,
  "pluginVersion": "0.1.0",
  "platform": "azure",
  "tier": 2,
  "repo": {
    "owner": "contoso",
    "name": "usage-digest",
    "defaultBranch": "main"
  },
  "stack": {
    "language": "typescript",
    "packageManager": "pnpm"
  },
  "commands": {
    "verify": "pnpm verify",
    "format": "pnpm prettier --write",
    "lint": "pnpm eslint"
  },
  "environments": {
    "dev": { "gate": "none" },
    "staging": { "gate": "auto" },
    "prod": { "gate": "human", "approvers": ["release-managers"], "deployCommandPatterns": ["git push * main", "az pipelines run *", "kubectl apply *", "helm upgrade *", "terraform apply *"] }
  },
  "team": {
    "mode": "team",
    "enablePluginForTeam": true
  },
  "review": {
    "requiredApprovals": 1,
    "nitCap": 5
  },
  "cost": {
    "maxTurns": 40,
    "maxBudgetUsd": 5,
    "alertThresholdUsd": 25
  },
  "guardrails": {
    "requireTicket": true,
    "protectedPaths": [".github/workflows/**", ".azuredevops/**", "CODEOWNERS", "sdlc.config.json", ".claude/settings.json", "pnpm-lock.yaml"],
    "secretPaths": [".env", ".env.*", "secrets/**", "**/*.pem"],
    "testGlobs": ["**/*.test.ts", "**/*.spec.ts", "**/__tests__/**", "**/tests/**"]
  },
  "artifacts": {
    "dir": ".sdlc"
  },
  "metrics": {
    "incidentLabel": "incident",
    "deployEnvironment": "production",
    "maxPrs": 200
  },
  "azure": {
    "organization": "https://dev.azure.com/contoso",
    "project": "Platform",
    "repo": "usage-digest",
    "workItemType": "User Story",
    "requiredReviewers": ["lead@contoso.com"],
    "pipelineName": "sdlc-pr-review",
    "deployPipelineName": "sdlc-deploy"
  },
  "github": {
    "requiredChecks": ["sdlc-pr-review"],
    "deployWorkflow": "sdlc-deploy.yml"
  },
  "reuse": {
    "mattpocockSkills": "plugin"
  }
}
